{
  "api_version": "compute-connector/v1alpha1",
  "job_id": "job_01",
  "workspace_id": "workspace_01",
  "name": "small-llm-batch",
  "active_attempt_id": "attempt_01",
  "state": {
    "orchestration": "preparing",
    "execution": "not_submitted",
    "result": "not_available",
    "cancellation": "not_requested",
    "remote_activity": "not_started",
    "release_evidence": "unknown",
    "deadline_exceeded": false
  },
  "revision": 3,
  "created_at": "2026-09-13T13:00:00Z",
  "updated_at": "2026-09-13T13:05:00Z",
  "links": {
    "self": "/v1/workspaces/workspace_01/jobs/job_01",
    "events": "/v1/workspaces/workspace_01/jobs/job_01/events",
    "attempts": "/v1/workspaces/workspace_01/jobs/job_01/attempts",
    "artifacts": "/v1/workspaces/workspace_01/jobs/job_01/artifacts"
  },
  "preparation": {
    "progress": {
      "scope": "staged_input_bytes",
      "generation": 1,
      "bytes_completed": 402653184,
      "bytes_total": 1073741824,
      "observed_at": "2026-10-10T09:00:00Z"
    }
  }
}
